{"$schema": "http://json-schema.org/schema#", "type": "object", "properties": {"id": {"type": "string"}, "channel": {"type": "string"}, "channel_id": {"type": "string"}, "title": {"type": "string"}, "availability": {"type": "null"}, "channel_follower_count": {"type": "integer"}, "description": {"type": "string"}, "tags": {"type": "array", "items": {"type": "string"}}, "thumbnails": {"type": "array", "items": {"type": "object", "properties": {"url": {"type": "string"}, "height": {"type": "integer"}, "width": {"type": "integer"}, "preference": {"type": "integer"}, "id": {"type": "string"}, "resolution": {"type": "string"}}, "required": ["id", "url"]}}, "uploader_id": {"type": "string"}, "uploader_url": {"type": "string"}, "modified_date": {"type": "null"}, "view_count": {"type": "null"}, "playlist_count": {"type": "integer"}, "uploader": {"type": "string"}, "channel_url": {"type": "string"}, "_type": {"type": "string"}, "entries": {"type": "array", "items": {"type": "object", "properties": {"id": {"type": "string"}, "channel": {"type": ["null", "string"]}, "channel_id": {"type": ["null", "string"]}, "title": {"type": "string"}, "availability": {"type": "null"}, "channel_follower_count": {"type": "integer"}, "description": {"type": ["null", "string"]}, "tags": {"type": "array", "items": {"type": "string"}}, "thumbnails": {"type": "array", "items": {"type": "object", "properties": {"url": {"type": "string"}, "height": {"type": "integer"}, "width": {"type": "integer"}, "preference": {"type": "integer"}, "id": {"type": "string"}, "resolution": {"type": "string"}}, "required": ["url"]}}, "uploader_id": {"type": ["null", "string"]}, "uploader_url": {"type": ["null", "string"]}, "modified_date": {"type": "null"}, "view_count": {"type": ["integer", "null"]}, "playlist_count": {"type": "integer"}, "uploader": {"type": ["null", "string"]}, "channel_url": {"type": ["null", "string"]}, "_type": {"type": "string"}, "entries": {"type": "array", "items": {"type": "object", "properties": {"_type": {"type": "string"}, "ie_key": {"type": "string"}, "id": {"type": "string"}, "url": {"type": "string"}, "title": {"type": "string"}, "description": {"type": ["null", "string"]}, "duration": {"type": "number"}, "channel_id": {"type": "null"}, "channel": {"type": ["null", "string"]}, "channel_url": {"type": "null"}, "uploader": {"type": ["null", "string"]}, "uploader_id": {"type": "null"}, "uploader_url": {"type": "null"}, "thumbnails": {"type": "array", "items": {"type": "object", "properties": {"url": {"type": "string"}, "height": {"type": "integer"}, "width": {"type": "integer"}}, "required": ["height", "url", "width"]}}, "timestamp": {"type": "null"}, "release_timestamp": {"type": "null"}, "availability": {"type": ["null", "string"]}, "view_count": {"type": ["integer", "null"]}, "live_status": {"type": ["null", "string"]}, "channel_is_verified": {"type": ["boolean", "null"]}, "__x_forwarded_for_ip": {"type": "null"}}, "required": ["__x_forwarded_for_ip", "_type", "id", "ie_key", "thumbnails", "title", "url", "view_count"]}}, "extractor_key": {"type": "string"}, "extractor": {"type": "string"}, "webpage_url": {"type": "string"}, "__x_forwarded_for_ip": {"type": "null"}, "release_year": {"type": "null"}, "epoch": {"type": "integer"}, "ie_key": {"type": "string"}, "url": {"type": "string"}, "duration": {"type": "number"}, "timestamp": {"type": "null"}, "release_timestamp": {"type": "null"}, "live_status": {"type": "null"}, "channel_is_verified": {"type": "boolean"}}, "required": ["__x_forwarded_for_ip", "_type", "availability", "channel", "channel_id", "channel_url", "description", "id", "thumbnails", "title", "uploader", "uploader_id", "uploader_url", "view_count"]}}, "webpage_url": {"type": "string"}, "original_url": {"type": "string"}, "webpage_url_basename": {"type": "string"}, "webpage_url_domain": {"type": "string"}, "extractor": {"type": "string"}, "extractor_key": {"type": "string"}, "release_year": {"type": "null"}, "epoch": {"type": "integer"}, "_version": {"type": "object", "properties": {"version": {"type": "string"}, "current_git_head": {"type": "null"}, "release_git_head": {"type": "string"}, "repository": {"type": "string"}}, "required": ["current_git_head", "release_git_head", "repository", "version"]}}, "required": ["_type", "_version", "availability", "channel", "channel_follower_count", "channel_id", "channel_url", "description", "entries", "epoch", "extractor", "extractor_key", "id", "modified_date", "original_url", "playlist_count", "release_year", "tags", "thumbnails", "title", "uploader", "uploader_id", "uploader_url", "view_count", "webpage_url", "webpage_url_basename", "webpage_url_domain"]}
