{
  "id": "UC4QobU6STFB0P71PMvOGN5A",
  "channel": "jawed",
  "channel_id": "UC4QobU6STFB0P71PMvOGN5A",
  "title": "jawed - Videos",
  "availability": null,
  "channel_follower_count": 5720000,
  "description": "",
  "tags": [
    "me at the zoo",
    "jawed karim",
    "first youtube video"
  ],
  "thumbnails": [
    {
      "url": "https://yt3.googleusercontent.com/9oxdo7zGCuEofTfnBIuUAf7B0ynncs-aQmgx9lXQ33VRwrJyQlHmYpH6wfczKgGYfVThQ31dhg=w1060-fcrop64=1,00005a57ffffa5a8-k-c0xffffffff-no-nd-rj",
      "height": 175,
      "width": 1060,
      "preference": -10,
      "id": "0",
      "resolution": "1060x175"
    },
    {
      "url": "https://yt3.googleusercontent.com/9oxdo7zGCuEofTfnBIuUAf7B0ynncs-aQmgx9lXQ33VRwrJyQlHmYpH6wfczKgGYfVThQ31dhg=w1138-fcrop64=1,00005a57ffffa5a8-k-c0xffffffff-no-nd-rj",
      "height": 188,
      "width": 1138,
      "preference": -10,
      "id": "1",
      "resolution": "1138x188"
    },
    {
      "url": "https://yt3.googleusercontent.com/9oxdo7zGCuEofTfnBIuUAf7B0ynncs-aQmgx9lXQ33VRwrJyQlHmYpH6wfczKgGYfVThQ31dhg=w1707-fcrop64=1,00005a57ffffa5a8-k-c0xffffffff-no-nd-rj",
      "height": 283,
      "width": 1707,
      "preference": -10,
      "id": "2",
      "resolution": "1707x283"
    },
    {
      "url": "https://yt3.googleusercontent.com/9oxdo7zGCuEofTfnBIuUAf7B0ynncs-aQmgx9lXQ33VRwrJyQlHmYpH6wfczKgGYfVThQ31dhg=w2120-fcrop64=1,00005a57ffffa5a8-k-c0xffffffff-no-nd-rj",
      "height": 351,
      "width": 2120,
      "preference": -10,
      "id": "3",
      "resolution": "2120x351"
    },
    {
      "url": "https://yt3.googleusercontent.com/9oxdo7zGCuEofTfnBIuUAf7B0ynncs-aQmgx9lXQ33VRwrJyQlHmYpH6wfczKgGYfVThQ31dhg=w2276-fcrop64=1,00005a57ffffa5a8-k-c0xffffffff-no-nd-rj",
      "height": 377,
      "width": 2276,
      "preference": -10,
      "id": "4",
      "resolution": "2276x377"
    },
    {
      "url": "https://yt3.googleusercontent.com/9oxdo7zGCuEofTfnBIuUAf7B0ynncs-aQmgx9lXQ33VRwrJyQlHmYpH6wfczKgGYfVThQ31dhg=w2560-fcrop64=1,00005a57ffffa5a8-k-c0xffffffff-no-nd-rj",
      "height": 424,
      "width": 2560,
      "preference": -10,
      "id": "5",
      "resolution": "2560x424"
    },
    {
      "url": "https://yt3.googleusercontent.com/9oxdo7zGCuEofTfnBIuUAf7B0ynncs-aQmgx9lXQ33VRwrJyQlHmYpH6wfczKgGYfVThQ31dhg=s0",
      "id": "banner_uncropped",
      "preference": -5
    },
    {
      "url": "https://yt3.googleusercontent.com/uI3VE4PVqvCy0xnWLqMJnEzyBUm3T8VHOCp4ee-1RxdHqKXCdUE_qXYQnpf9AfuEoIPactVyDhM=s900-c-k-c0x00ffffff-no-rj",
      "height": 900,
      "width": 900,
      "id": "7",
      "resolution": "900x900"
    },
    {
      "url": "https://yt3.googleusercontent.com/uI3VE4PVqvCy0xnWLqMJnEzyBUm3T8VHOCp4ee-1RxdHqKXCdUE_qXYQnpf9AfuEoIPactVyDhM=s0",
      "id": "avatar_uncropped",
      "preference": 1
    }
  ],
  "uploader_id": "@jawed",
  "uploader_url": "https://www.youtube.com/@jawed",
  "modified_date": null,
  "view_count": null,
  "playlist_count": 1,
  "uploader": "jawed",
  "channel_url": "https://www.youtube.com/channel/UC4QobU6STFB0P71PMvOGN5A",
  "_type": "playlist",
  "entries": [
    {
      "_type": "url",
      "ie_key": "Youtube",
      "id": "jNQXAC9IVRw",
      "url": "https://www.youtube.com/watch?v=jNQXAC9IVRw",
      "title": "Me at the zoo",
      "description": "Microplastics are accumulating in human brains at an alarming rate\nhttps://www.youtube.com/watch?v=0PT5c1z3LL8\n\n\u201cNanoplastics and Human Health\u201d with Matthew J Campen, PhD, MSPH\nhttps://www.yout...",
      "duration": 19.0,
      "channel_id": null,
      "channel": null,
      "channel_url": null,
      "uploader": null,
      "uploader_id": null,
      "uploader_url": null,
      "thumbnails": [
        {
          "url": "https://i.ytimg.com/vi/jNQXAC9IVRw/hqdefault.jpg?sqp=-oaymwE1CKgBEF5IVfKriqkDKAgBFQAAiEIYAXABwAEG8AEB-AG-AoAC8AGKAgwIABABGFUgWShlMA8=&rs=AOn4CLD0z8RhQhBpOGg7rE1WwNmsXhJviQ",
          "height": 94,
          "width": 168
        },
        {
          "url": "https://i.ytimg.com/vi/jNQXAC9IVRw/hqdefault.jpg?sqp=-oaymwE1CMQBEG5IVfKriqkDKAgBFQAAiEIYAXABwAEG8AEB-AG-AoAC8AGKAgwIABABGFUgWShlMA8=&rs=AOn4CLDEByjISd3w-TM9Pzzz3rxWDxLQNw",
          "height": 110,
          "width": 196
        },
        {
          "url": "https://i.ytimg.com/vi/jNQXAC9IVRw/hqdefault.jpg?sqp=-oaymwE2CPYBEIoBSFXyq4qpAygIARUAAIhCGAFwAcABBvABAfgBvgKAAvABigIMCAAQARhVIFkoZTAP&rs=AOn4CLAtWrYHlO_zHK-I-52tzA86tqSeAw",
          "height": 138,
          "width": 246
        },
        {
          "url": "https://i.ytimg.com/vi/jNQXAC9IVRw/hqdefault.jpg?sqp=-oaymwE2CNACELwBSFXyq4qpAygIARUAAIhCGAFwAcABBvABAfgBvgKAAvABigIMCAAQARhVIFkoZTAP&rs=AOn4CLB7NY0fx4yZYDj27223V3b7Sowf5w",
          "height": 188,
          "width": 336
        }
      ],
      "timestamp": null,
      "release_timestamp": null,
      "availability": null,
      "view_count": 372395946,
      "live_status": null,
      "channel_is_verified": true,
      "__x_forwarded_for_ip": null
    }
  ],
  "extractor_key": "YoutubeTab",
  "extractor": "youtube:tab",
  "webpage_url": "https://www.youtube.com/jawed/videos",
  "original_url": "https://www.youtube.com/jawed",
  "webpage_url_basename": "videos",
  "webpage_url_domain": "youtube.com",
  "release_year": null,
  "epoch": 1758953505,
  "_version": {
    "version": "2025.09.26",
    "current_git_head": null,
    "release_git_head": "12b57d2858845c0c7fb33bf9aa8ed7be6905535d",
    "repository": "yt-dlp/yt-dlp"
  }
}
